uid,body,title,url,newspaper_uid,host,n_tokens_body,n_tokens_title
30fa0bf688c3326f8f2c36eaab3e7009,"Sistema Solar.Saturno supera a Júpiter y se convierte en el planeta con más lunas: 82Aniversario.30 cumpleaños del Hubble: el telescopio que cambió nuestra visión del cosmosAstronomía.Un telescopio capta por primera vez una estrella similar al Sol con dos exoplanetasEl telescopio espacial Hubble ha capturado una detallada imagen de Saturno que muestra el verano en el hemisferio norte, los anillos y dos de las lunas heladas del planeta. La instantánea se realizó el pasado 4 de julio, cuando el segundo mayor planeta del Sistema Solar se encontraba a 1.350 millones de kilómetros de la Tierra.Dos de las lunas heladas de Saturno son claramente visibles en la imagen completa: Mimas, a la derecha, y Encélado, en la parte inferior. La composición forma parte del proyecto Legado de Atmósferas de los Planetas Exteriores (OPAL, por sus siglas en inglés), que ayuda a los científicos a comprender las dinámicas atmosféricas y la evolución de los gigantes gaseosos del Sistema Solar. En el caso de Saturno, los astrónomos realizan un seguimiento de los patrones climáticos cambiantes y las tormentas.El Hubble encontró una serie de pequeñas tormentas atmosféricas, que parecen ir y venir con cada observación anual. Las bandas en la atmósfera presentes en el hemisferio norte continúan siendo claramente visibles, igual que en las observaciones realizadas por el Hubble en 2019, con varias bandas cambiando ligeramente de color. La atmósfera del planeta anillado es principalmente hidrógeno y helio con trazas de amoniaco, metano, vapor de agua e hidrocarburos que le dan un color marrón amarillento.En la imagen también se puede apreciar una ligera neblina rojiza sobre el hemisferio norte, que puede ser debida al calentamiento causado por el aumento de la luz solar. Esto podría cambiar la circulación atmosférica o tal vez deshacer el hielo de los aerosoles en la atmósfera. Otra teoría es que el aumento de la luz solar en los meses de verano está cambiando las cantidades de niebla fotoquímica producida. ""Es increíble que incluso en unos pocos años estamos viendo cambios estacionales en Saturno"", asegura la investigadora principal Amy Simon, del Centro de Vuelos Espaciales Goddard de la NASA en Greenbelt, Maryland. Por otro lado, el polo sur, invisible hasta hace poco tiempo, tiene un tono azulado que refleja los cambios en el hemisferio invernal de Saturno.EL MISTERIO DE LOS ANILLOSLa aguda vista del Hubble muestra la ""delicadamente bordada"" estructura concéntrica de los anillos, según la NASA. Los anillos están formados principalmente de trozos de hielo, con tamaños que van desde granos diminutos hasta rocas gigantes. Cómo y cuándo se formaron los anillos sigue siendo uno de los mayores misterios de nuestro sistema solar. La sabiduría convencional es que son tan viejos como el planeta, más de 4 mil millones de años. Pero debido a que los anillos son tan brillantes -como la nieve recién caída- otra teoría asegura que pueden haberse formado durante la era de los dinosaurios. Muchos astrónomos están de acuerdo en que no existe una teoría lo suficientemente satisfactoria que explique cómo se pudieron haber formado los anillos en los últimos cientos de millones de años. ""Sin embargo, las mediciones de la sonda Cassini realizadas a minúsculos granos que llueven en la atmósfera de Saturno sugieren que los anillos sólo pueden durar 300 millones de años más, lo que es uno de los argumentos para una edad joven del sistema de anillos"", defiende Michael Wong, de la Universidad de CaliforniaEl Telescopio Espacial Hubble es un proyecto de cooperación internacional entre la NASA y la ESA (Agencia Espacial Europea) administrado desde el Centro de Vuelos Espaciales Goddard de la NASA en Greenbelt, Maryland. Este año se ha celebrado el 30 aniversario de su lanzamiento, convertido en un icono de la investigación espacial por su fabuloso legado científico y cultural.Conforme a los criterios deThe Trust ProjectSaber másCiencia y SaludElecciones Galicia 2020Alberto Núñez Feijóo, el heredero del PP gallego que ha igualado a FragaElecciones Gallegas 2020Alberto Núñez Feijóo logra su cuarta mayoría absoluta, el BNG alcanza el segundo puesto y Podemos desapareceElecciones vascas 2020Iñigo Urkullu: el hijo del tornero refuerza el nacionalismo más pragmáticoVer enlaces de interésNoticiasTraductorProgramacionCalendarioHoroscopoClasificacionPeliculasNotas corteTemasfunction doSomething(element){if(element.parentNode.classList.contains(""ue-c-popular-links--closed"")){return openFeaturedLinks(element.parentNode,element,element.parentNode.querySelectorAll(""ul""));}return closeFeaturedLinks(element.parentNode,element,element.parentNode.querySelectorAll(""ul""));}function openFeaturedLinks(element,button,uls){element&&element.classList.toggle(""ue-c-popular-links--closed"");button&&button.setAttribute('aria-expanded','true');let span=button&&button.querySelector(""span"");span.innerHTML=""Cerrar enlaces de inter&eacute;s"";if(uls){uls.forEach((ul)=>{ul&&ul.setAttribute('aria-hidden','false');ul&&ul.classList.remove(""hidden-content"");})}}function closeFeaturedLinks(element,button,uls){element&&element.classList.toggle(""ue-c-popular-links--closed"");button&&button.setAttribute('aria-expanded','false');let span=button&&button.querySelector(""span"");span.innerHTML=""Ver enlaces de inter&eacute;s"";if(uls){uls.forEach((ul)=>{ul&&ul.setAttribute('aria-hidden','true');ul&&ul.classList.add(""hidden-content"");})}}",La NASA publica una espectacular imagen de Saturno capturada por el telescopio Hubble,https://www.elmundo.es/ciencia-y-salud/ciencia/2020/07/28/5f1fe6a0fc6c83313d8b45ac.html,web-scraper/elmundo,www.elmundo.es,685,13
306a1053f63a5a4be70e8c5d3266b3bf,"Directo.Última hora sobre el coronavirusCovid-19.Los rebrotes en Madrid por municipiosLa Comunidad de Madrid va a decretar el uso obligatorio de la mascarilla también en espacios al aire libre, incluidas las terrazas, para tratar de controlar los rebrotes de coronavirus en la región. La medida entrará en vigor a partir de este jueves con excepciones para los menores de seis años y quienes realicen actividades deportivas al aire libre. Además, la presidenta regional, Isabel Díaz Ayuso, ha anunciado que su Gobierno pondrá en marcha de forma piloto una cartilla Covid para que quienes han pasado la enfermedad y tienen anticuerpos, ""por lo que no pueden contagiar ni ser contagiados"", puedan acceder a gimnasios, museos, cines y otros espacios de forma segura. Se activará de forma experimental en septiembre.Estas medidas están incluidas en el plan de contingencia que la Comunidad de Madrid ha presentado este martes tras identificar 11 rebrotes de coronavirus con 70 positivos y 319 contactos bajo vigilancia. Además, si fuera necesario, se reactivarían dos pabellones de Ifema para trasladar allí a los contagiados que precisen hospitalización y se va a limitar el aforo de las terrazas a grupos de un máximo de 10 personas, al igual que en parques, jardines y zonas comunes, recomendación que se hace extensiva a las reuniones de ámbito privado.Otra de las novedades es que los bares de copas, las discotecas y las terrazas deberán cerrar a la una y media y no podrán admitir clientes pasada la una. Asimismo, los locales de restauración y de ocio nocturno deberán tener un registro de entrada con DNI y número de teléfono de contacto para facilitar el trabajo de los rastreadores en el caso de que posteriormente se detecte algún positivo que estuvo en dichos establecimientos.El consejero de Sanidad, Enrique Ruiz Escudero, ha confirmado que se ha producido un ""cambio de tendencia"" en la evolución de la enfermedad en la región después de que se hayan detectado más de 500 nuevos casos desde el viernes. Además, ha incidido en que la edad media de los afectados se ha desplomado de 55 a 35 años en apenas tres semanas, por lo que en la nueva estrategia anti-coronavirus se incluyen recomendaciones específicas para dicho colectivo, como evitar que se compartan copas y minis de bebida, así como cachimbas. ""Estamos preocupados por el comportamiento de muchos jóvenes y es importante que entiendan que ellos también son transmisores de la epidemia"", ha advertido Ayuso. ""Ahora la clave es poner sobre la mesa una batería de medidas de choque para impedir volver a atrás y, sobre todo, para evitar por encima de cualquier cosa el confinamiento total al que fuimos sometidos en la primera etapa contra el Covid"", ha recalcado Ayuso.Ante el aumento de casos, la Consejería de Sanidad va a duplicar el número de rastreadores de contactos estrechos de los positivos por coronavirus hasta los 360 con nuevas contrataciones que está previsto que se hagan esta misma semana. Además habrá una ""bolsa"" de profesionales sanitarios ""para aumentar su número en función de las necesidades que se presenten"". La Comunidad de Madrid ha solicitado además colaboración a los ayuntamientos de la región para que, a través de sus policías locales, garanticen el cumplimiento de la normativa de Salud Pública por parte de los contagiados o sospechosos de poder estarlo que deban permanecer en aislamiento.Illa discrepa con AyusoPor su parte, el ministro de Sanidad, Salvador Illa, ha advertido a la presidenta de la Comunidad de Madrid que la cartilla anunciada este martes no está contemplada ""por ningún organismo internacional, ni la Organización Mundial de la Salud"" ni por ninguno de los documentos técnicos que ha elaborado su departamento.  ""No lo recogemos en ninguno de nuestros documentos ni ningún organismo internacional apoya medidas de este tipo"", ha justificado Illa en rueda de prensa tras el Consejo de Ministros de este martes, apostillando que ha conocido la puesta en marcha de esta medida a través de los medios y no por comunicación directa con las autoridades madrileñas, informa Europa Press.Conforme a los criterios deThe Trust ProjectSaber másCoronavirusCovid 19Covid-19Conselleria aporta un coche sanitario al ambulatorio que atiende el rebrote del barrio de San LorenzoPolíticaAyuso accede a reducir el tamaño de su Gobierno a cambio de que Vox apoye los Presupuestos de MadridCataluñaUn positivo en un campamento infantil de Girona obliga a aislar a 12 personas, entre niños y monitoresVer enlaces de interésNoticiasProgramacion TVTraductorCalendario MadridCalendario Madrid capitalCalendarioHoroscopoClasificacionCalendario ligaTemasfunction doSomething(element){if(element.parentNode.classList.contains(""ue-c-popular-links--closed"")){return openFeaturedLinks(element.parentNode,element,element.parentNode.querySelectorAll(""ul""));}return closeFeaturedLinks(element.parentNode,element,element.parentNode.querySelectorAll(""ul""));}function openFeaturedLinks(element,button,uls){element&&element.classList.toggle(""ue-c-popular-links--closed"");button&&button.setAttribute('aria-expanded','true');let span=button&&button.querySelector(""span"");span.innerHTML=""Cerrar enlaces de inter&eacute;s"";if(uls){uls.forEach((ul)=>{ul&&ul.setAttribute('aria-hidden','false');ul&&ul.classList.remove(""hidden-content"");})}}function closeFeaturedLinks(element,button,uls){element&&element.classList.toggle(""ue-c-popular-links--closed"");button&&button.setAttribute('aria-expanded','false');let span=button&&button.querySelector(""span"");span.innerHTML=""Ver enlaces de inter&eacute;s"";if(uls){uls.forEach((ul)=>{ul&&ul.setAttribute('aria-hidden','true');ul&&ul.classList.add(""hidden-content"");})}}",La mascarilla será obligatoria también en espacios al aire libre de Madrid a partir del jueves y habrá una cartilla Covid-19,https://www.elmundo.es/madrid/2020/07/28/5f1ffa0a21efa0e2798b457a.html,web-scraper/elmundo,www.elmundo.es,719,18
10b9b4bf5ece5bb154a37a7d8e5abfa1," googletag.cmd.push(function () { googletag.display('div-gpt-ad-deportes_ne_r-prv_5f1c422f21efa0a3368bf352'); }); PREMIUMSERGIO R. VIÑAS@sergioroviActualizado                         Lunes,    27    julio    2020    -         15:49    Compartir en FacebookCompartir en TwitterEnviar por emailNoche gloriosa de Champions, de esas tan añoradas estos últimos meses. La estrella del equipo se ha vaciado en el campo, ha marcado un par de goles o tres, ha picado algo para recuperar y se ha ido a su casa a descansar a pierna suelta. Ha llegado directo del campo -se ha portado bien, digamos-, pero ya tarde, de madrugada, así que ha caído rendido en la cama tan pronto la ha tocado.Suena bien, hasta idílico. Pero no es cierto. La realidad, en la mayoría de los casos, es otra muy diferente. El estrés de un día así, la adrenalina acumulada y la exigencia muscular acaban pasando factura, provocando que el sueño sea difícil de conciliar. Saúl Para seguir leyendo, hazte Premium¿Ya eres Premium? Inicia sesiónMensualOferta de verano1€/mes durante 2 mesesy después 7,99 € Lo quieroAnual4 meses gratis59€Gratis 1 año de Legálitas Estándar (valorado en 240€)Lo quiero Descubre qué es Premium  Cancela cuando quieras   Consulta los términos y condiciones del servicio Conforme a los criterios deThe Trust ProjectSaber más","Masajes y joyas para dormir: el colchón de Messi, Saúl o Agüero",https://www.elmundo.es/deportes/mas-deporte/2020/07/27/5f1c422f21efa0a3368bf352.html,web-scraper/elmundo,www.elmundo.es,162,10
2e207744e9f8b9be6be7a3857629c88f,"Actualidad.Últimas noticias de músicaCae la tarde y aún fuego en Sevilla. En la trasera del Mercado de la calle Feria parte de los Derby Motoreta's Burrito Kachimba (DBMK) ya sostiene una Cruzcampo. Hoy deberían estar sobre un escenario ""del tamaño de una pista de tenis"" en alguno de los principales festivales del país. Y el plan era viajar a América en septiembre. El año pasado, este grupo de psicodelia que bebe del rock andaluz de los años 70 logró lo imposible con su primer disco. En plena era del trap, consiguieron que los promotores de todo el país volvieran la vista hacia el sur, hicieron que el público joven descubriese qué es una guitarra eléctrica, aparecieron en la revista Billboard como la perla de la nueva música española, ganaron el Premio Ruido al Mejor Disco del Año y aglutinaron 50.000 oyentes mensuales en Spotify. Entonces, cuando les tocaba saborear las mieles de su confirmación, llegó 2020 con la pandemia. ""Y nos dejó en el limbo"". ¿Qué ocurre cuando una crisis global te pilla en pleno pelotazo? DBMK trabaja hoy por revalidar su propuesta en este momento complejo: apenas hay conciertos, pero la música mantiene su ritmo frenético de fagocitar y luego regurgitar estilos. Así las cosas, nadie les asegura que, cuando vuelva el mundo a ser mundo, la kinkidelia -término que ellos mismos han arrojado y que el público se bebió como un vasito de agua- vaya a funcionar como hasta ahora, pero han decidido seguir trabajando como si nada, conscientes de que el suyo va a ser un camino de largo recorrido. ""Teníamos cada día del año ocupado en el calendario, hasta diciembre; en vez de eso, nos estamos dedicando a ensayar y rematar el siguiente disco, que saldrá en enero, y es algo que estamos disfrutando mucho. No queremos conservar nada ni tampoco dar un volantazo, la idea es hacer algo mejor"". Hace unos días, lanzaron el primer adelanto, El valle. El vídeo que lo acompaña es un sugerente y cañero spaghetti western con tintes de Bola de Dragón que ya supera las 100.000 visitas en YouTube. La canción tiene en los créditos la firma de oro de Brian Lucy, que ha masterizado trabajos para Arctic Monkeys, The Black Keys y Green Day, entre otros. Antes de que el mundo saltara por los aires, DBMK se habían subido a un cometa al que pocas bandas logran hoy encaramarse. Antes de toda esta ""fantasía"", como ellos definen su ascenso, Miguel -Dandy Piranha-, el magnético y genuino cantante, era repartidor de Glovo. ""¡Antes y durante! Después del concierto del Primavera Sound, llegué a Sevilla y me puse a pedalear"", matiza este extremeño que compuso varios temas del primer disco mientras se ganaba la vida en Edimburgo. Una lo mira y ve ya a una estrella total, pese a la suavidad de su talante. ""No hemos venido a la entrevista en limusina"", continúan. Pueden tomarse una cerveza sin ser asediados (aunque sí observados), pero han logrado aparcar la precariedad para salir en revistas, llenar las grandes salas de Madrid y Barcelona, y presumir de un público que se sabe todos sus temas, gente a la que pueden mirar a los ojos, que les cae bien. ""Podemos hablar de un triunfo relativo, eso en la música es pagar el alquiler y la comida y dedicar todo tu tiempo a pensar en tu grupo. Hemos trabajado dos años como locos y ahora podemos dar los siguientes pasos con margen"", plantea Scott, guitarrista. Todo les sucedió muy rápido. En un Monkey Weekend en el Puerto de Santa María alguien dijo: ""En la plaza del Castillo toca ahora el mejor grupo de Sevilla"". En ese festival se prendió la mecha. Muchos corrieron a descubrir su ritual concebido como ""un viaje en cohete"", ajeno a las misas en el hielo que hemos contemplado en otros estilos estos últimos años, para desplegarse como un verdadero show que se mira en los conciertos de The Doors y de Led Zeppelin. ""Siempre se lía parda"", presumen. El pogo, que en paz descanse, es (era) la reacción habitual de su público. ""Desde el principio concebimos el grupo como una propuesta de 360 grados. No entras a una canción, sino a un universo musical, estético, visual"". Grabaron cuatro temas y a la media hora de subirlos a Bandcamp, les llamaron del Primavera. Literal. Para cuando salió el disco, habían logrado generar un creciente runrún a su alrededor. ""Entramos directos a las listas, por encima de Melendi"", celebran con los ojos aún muy abiertos. Justicia poética. ""No estuvimos dándole muchas vueltas a lo que habíamos hecho, queríamos lanzarlo cuanto antes. Cogimos las imágenes de la peli Callejeros, les pusimos nuestras caras por encima y publicamos el primer videoclip. Scott se pasó cuatro días exportándolo con un ordenador de un giga de memoria. Pero salió y gustó mucho, creo que la gente apreció esa frescura. Sin embargo, que el disco entrase en listas significaba que el público, además de escucharnos en internet, nos estaba comprando"", recuerda Dandy. En el single que acaban de publicar se aprecia esta apuesta por aportar a sus fans un concepto que no acaba en las canciones. Van dejándose asesorar, pero viven casi en la autogestión, en cada decisión tienen la última palabra. Para el vídeo idearon que cada componente pareciese de un planeta distinto. Uno va en chándal; otro, envuelto en pieles. Miguel lleva una chaqueta de cuero rojo y unos pantalones de campana ajustados en el mismo color. Glam y kinki, flamenco y psicodelia. ""Lo que mejor nos define es que somos hombres de las praderas. El que quiera, que lo entienda, ahí está todo"" .Tras un año de locura -aún se emocionan al pensarse sobre un escenario en el que iba a tocar Liam Gallagher un rato después-, los Derby volvieron a casa para actuar ante el público de Sevilla, una ciudad que se había olvidado de que en los años 70, mientras medio país seguía agarrado a las faldas del franquismo, grupos como Triana pusieron a desfilar una modernidad inusitada por el sur. Hoy, ellos son los responsables de que vuelva a reivindicarse aquella contracultura, aunque se vean tan reflejados ahí como en Tame Impala. ""Los grupos de la nueva psicodelia han conseguido ventilar la habitación y nosotros nos hemos traído esta modernización al sur"". Después de su meteórico periplo, decíamos, fueron recibidos en Sevilla como si vinieran de ganar el mundial, con un orgullo de hincha entre sus paisanos. ""Miguel se fue a llorar tras el escenario en cuanto acabó el concierto"", se ríe Scott. ""Es bonito poder hacer lo que te gusta, de forma totalmente desacomplejada, sin que te importe nada más. Y descubrir que no todo es Malasaña, estamos contentos de que en parte gracias a lo que ha ocurrido con nosotros se esté mirando más hacia la música de aquí"". En enero -""fijo, a no ser que vengan los alienígenas ya""- se publica su nuevo trabajo. Lo de los escenarios, ya poco a poco. De momento, el próximo 6 de agosto actúan en el ciclo Pop CAAC de Sevilla, donde, con toda seguridad, volverán a llenar. ""El disco aporta más leña, más psicodelia y más poesía, letras de contenido nebuloso, de libre interpretación, canciones que salen de las entrañas para ser interpretadas con pellizco. Lo que queremos es que lo que produzcamos vuelva a hacerle un click quienes nos escuchan. El que habla del universo no se equivoca, eso es así"", remata Miguel. Scott añade: ""Con Triana y con muchos grupos que nos gustan hemos vivido verdaderos viajes. Nos hemos ahorrado años de budismo y meditación; a eso aspiramos"".Conforme a los criterios deThe Trust ProjectSaber másmúsicaRockculturaSevillaAndalucíaCulturaEl ruido y la furia de Joy Division, 40 años después del suicidio de Ian Curtis: ""Nunca sabremos quién era""La entrevista finalRicardo Pachón: ""A nadie le interesa el flamenco de los gitanos""MúsicaBenavent, Di Geraldo y Pardo: el silencio que fusionó el jazz con el flamenco retumba en MálagaVer enlaces de interésUltimas noticiasTraductor inglesProgramación TVQuijoteCalendario laboralHoroscopo diarioClasificacion Liga SantanderCalendario de ligaPeliculas TVTemasfunction doSomething(element){if(element.parentNode.classList.contains(""ue-c-popular-links--closed"")){return openFeaturedLinks(element.parentNode,element,element.parentNode.querySelectorAll(""ul""));}return closeFeaturedLinks(element.parentNode,element,element.parentNode.querySelectorAll(""ul""));}function openFeaturedLinks(element,button,uls){element&&element.classList.toggle(""ue-c-popular-links--closed"");button&&button.setAttribute('aria-expanded','true');let span=button&&button.querySelector(""span"");span.innerHTML=""Cerrar enlaces de inter&eacute;s"";if(uls){uls.forEach((ul)=>{ul&&ul.setAttribute('aria-hidden','false');ul&&ul.classList.remove(""hidden-content"");})}}function closeFeaturedLinks(element,button,uls){element&&element.classList.toggle(""ue-c-popular-links--closed"");button&&button.setAttribute('aria-expanded','false');let span=button&&button.querySelector(""span"");span.innerHTML=""Ver enlaces de inter&eacute;s"";if(uls){uls.forEach((ul)=>{ul&&ul.setAttribute('aria-hidden','true');ul&&ul.classList.add(""hidden-content"");})}}","Derby Motoreta's Burrito Kachimba: ""Con Triana nos ahorramos años de budismo""",https://www.elmundo.es/cultura/musica/2020/07/28/5f1eeeeefc6c83753e8b4571.html,web-scraper/elmundo,www.elmundo.es,1285,11
