uid,body,title,url,newspaper_uid,host,n_tokens_body,n_tokens_title
bde83f8b1b4a34e9c4def4c09bf36a1c," googletag.cmd.push(function () { googletag.display('div-gpt-ad-internacional_ne_r-prv_5f1f0578fc6c837e448b4579'); }); PREMIUMALBERTO MUÑOZLondresActualizado                         Martes,    28    julio    2020    -         01:34    Compartir en FacebookCompartir en TwitterEnviar por email                        Brexit.                                            Reino Unido y la UE admiten que siguen ""muy lejos"" de llegar a un acuerdo comercial                                            Tal día como hoy.                                            Sirimavo Bandaranaike: 60 años de mujeres en el poder                    El 28 de julio de 2005, tras 36 años de conflicto y más de 1.800 víctimas, el Ejército Republicano de Irlanda, IRA, por sus siglas en inglés, anunciaba el abandono de las armas. Su objetivo de conseguir una Irlanda del Norte independiente del Reino Unido pasaba entonces de la violencia al terreno político, donde durante esta década y media no ha conseguido tanto calado como el que puede haberles dado el proceso del Brexit. La salida de la Unión Europea y, por tanto, el distanciamiento político y económico entre las dos Irlandas, ha revivido la idea de la reunificación e, incluso, la de retomar la vía de la fuerza a través del autoproclamado NPara seguir leyendo, hazte Premium¿Ya eres Premium? Inicia sesiónMensualOferta de verano1€/mes durante 2 mesesy después 7,99 € Lo quieroAnual4 meses gratis59€Gratis 1 año de Legálitas Estándar (valorado en 240€)Lo quiero Descubre qué es Premium  Cancela cuando quieras   Consulta los términos y condiciones del servicio Conforme a los criterios deThe Trust ProjectSaber más","Irlanda del Norte, una paz amenazada por el Brexit",https://www.elmundo.es/internacional/2020/07/28/5f1f0578fc6c837e448b4579.html,web-scraper/elmundo,www.elmundo.es,184,9
b9411dfce4d9363175d6165f5dcb3993,"Sucesos.Halladas dos personas muertas y una herida a las afueras de El Álamo tras una gran reyertaLos dos fallecidos tras ser atropellados el domingo en El Álamo tras una reyerta entre dos familias eran una pareja de invitados a la pedida de mano que acabó de forma violenta, según fuentes de la Guardia Civil. Se descarta, así, que fueran la pareja de novios protagonistas de la pedida, como informaron en un primer momento algunos testigos de los hechos. La reyerta se inició por quién tocaba una canción en el órgano del restaurante.El hecho de que los dos jóvenes que protagonizaron la pedida huyeran tras la reyerta por la misma carretera en la que fueron atropellados mortalmente las dos víctimas pudo provocar la confusión, según las mismas fuentes. Los dos fallecidos son un hombre de 28 años y una mujer de 27, conocidos como 'Peque' y 'Jenny', que tenían cuatro hijos en común.La madre del primero, Rocío, ha asegurado este martes a Telemadrid que ""no fue un ajuste de cuentas, simplemente fue una pelea durante una fiesta'.Las investigaciones de la Guardia Civil continúan, aunque por el momento no se han producido mayores avances. Sí que se ha reforzado la presencia de agentes en El Álamo y en sus alrededores para evitar una eventual venganza entre los dos clanes gitanos implicados en la reyerta. La Guardia Civil también ha contactado con los patriarcas de ambos clanes para calmar los ánimos, informa Europa Press.Una tercera persona, una mujer de 18 años, resultó herida de gravedad y permanece ingresada en el Hospital 12 de Octubre de Madrid.Discusión por una canción La multitudinaria reyerta se originó por una discusión sobre quién tocaba una canción en un órgano que habían traído al restaurante que acogía la fiesta de la pedida de mano. Según han explicado a Europa Press testigos presenciales, la brutal pelea se gestó sobre las 23.30 horas del domingo cuando uno de los asistentes al evento estaba tocando una canción en dicho órgano, cuando otro hombre de un clan distinto se acercó a él y comenzaron a discutir si era el tema interpretado era adecuado o no. La discusión fue a más con diferentes recriminaciones cuando uno de ellos le golpeó, lo que generó una riña de empujones y puñetazos que se extendió a más miembros de los dos clanes, uno procedente de Navalcarnero y otro de Vallecas. Entonces comenzó una pelea ""brutal"", según han relatado los testigos consultados, en la que se implicaron buena parte de los más de 50 asistentes a la fiesta de pedida de mano, con multitud de golpes, amenazas y objetos arrojados. De hecho, uno de los testigos apreció cómo uno de los asistentes cogió su vehículo y llegó a golpear a tres personas, que fueron conducidos por sus propios familiares al Hospital Rey Juan Carlos de Móstoles. ""Fue una auténtica batalla campal"", ha recalcado.Conforme a los criterios deThe Trust ProjectSaber másGuardia CivilSucesosSucesosHallan a una mujer muerta en una fosa séptica en Tenerife tras detener a su ex parejaJusticiaA juicio 'La Manada' de Alicante que violó y grabó a una chica de 19 años: 'La manipularon a su antojo'Pazo de MeirásFrancis Franco: ""Lo único que no pagaba mi abuelo era la seguridad, tampoco la pagan en Galapagar""Ver enlaces de interésNoticiasProgramacion TVTraductorCalendario MadridCalendario Madrid capitalCalendarioHoroscopoClasificacionCalendario ligaTemasfunction doSomething(element){if(element.parentNode.classList.contains(""ue-c-popular-links--closed"")){return openFeaturedLinks(element.parentNode,element,element.parentNode.querySelectorAll(""ul""));}return closeFeaturedLinks(element.parentNode,element,element.parentNode.querySelectorAll(""ul""));}function openFeaturedLinks(element,button,uls){element&&element.classList.toggle(""ue-c-popular-links--closed"");button&&button.setAttribute('aria-expanded','true');let span=button&&button.querySelector(""span"");span.innerHTML=""Cerrar enlaces de inter&eacute;s"";if(uls){uls.forEach((ul)=>{ul&&ul.setAttribute('aria-hidden','false');ul&&ul.classList.remove(""hidden-content"");})}}function closeFeaturedLinks(element,button,uls){element&&element.classList.toggle(""ue-c-popular-links--closed"");button&&button.setAttribute('aria-expanded','false');let span=button&&button.querySelector(""span"");span.innerHTML=""Ver enlaces de inter&eacute;s"";if(uls){uls.forEach((ul)=>{ul&&ul.setAttribute('aria-hidden','true');ul&&ul.classList.add(""hidden-content"");})}}",La reyerta mortal entre familias en El Álamo se inició por quién tocaba una canción en el órgano del restaurante,https://www.elmundo.es/madrid/2020/07/28/5f1fe310fdddffaa018b457d.html,web-scraper/elmundo,www.elmundo.es,545,20
72b7194a7ad1924ebbaaa8b5e29d2e3e,"Justicia.El Tribunal Supremo tumba la semilibertad de Carme Forcadell y advierte de un ""fraude de ley"" de la GeneralitatCataluña.Quim Torra abre un nuevo frente contra la Iglesia con ataques al arzobispo de BarcelonaJusticia.Los condenados del 'procés' quedan libres este viernes y sólo irán cuatro días a dormir a prisiónEl Juzgado de Vigilancia Penitenciaria número 5 de Cataluña ha suspendido el tercer grado concedido por la Generalitat a Oriol Junqueras, Raül Romeva, Jordi Cuixart, Joaquim Forn y Jordi Sànchez. La juez ha estimado el recurso presentado este martes por la Fiscalía, en el que el Ministerio Público solicitaba la suspensión cautetar de esta semilibertad a los presos independentistas condenados por el procés. El Ministerio Fiscal también pedía la suspensión del tercer grado de la ex presidente del Parlamento catalán Carme Forcadell, pero el juzgado correspondiente aún no se ha pronunciado. En su resolución, el juzgado acuerda ""el efecto suspensivo"" del tercer grado, ""así como su tramitación preferente y urgente"", lo que se comunica a la prisión de Lledoners. Los internos tienen tres días para presentar alegaciones contra el recurso del fiscal.La decisión judicial responde a la petición de la Fiscalía de Barcelona, que ha presentado varios recursos contra la concesión del tercer grado penitenciario por parte del Departamento de Justicia de la Generalitat a tres ex responsables del Govern -Junqueras, Forn y Romeva-, a Forcadell, al líder de Òmnium Cultural -Jordi Cuixart- y al ex presidente de la ANC, Jordi Sànchez. Además,la Fiscalía estudia presentar el recurso contra la misma situación de los ex consejeros Jordi Turull, Josep Rull y Dolors Bassa. Todos fueron condenados por sedición por el Tribunal Supremo y desde hace unas semanas sólo acuden a dormir a la cárcel y pasan el fin de semana en casa gracias a este grado de semilibertad.No podrán salir de la cárcelTras la decisión judicial, los presos no podrán salir durante los días siguientes una vez ingresen en prisión en la noche de este martes. De momento, vuelven a estar catalogados en segundo grado, aunque está la duda de si conservan la aplicación del 100.2 del Reglamento Penitenciario que tenían antes y que cayó con el tercer grado. La única que lo tiene suspendido es Carme Forcadell tras rechazárselo el Tribunal Supremo.Desde la Fiscalía se indica que se ha optado primero por recurrir ante el Juzgado de Vigilancia Penitenciaria antes de acudir al Supremo, el órgano judicial que emitió la sentencia y que hace unos días emitió una resolución en la que se declaraba competente para decidir sobre los recursos presentados por los condenados. En ese caso respecto a la aplicación del artículo 100.2 del Reglamento Penitenciario también concedido a los soberanistas presos, pero que quedó suspendido por el tercer grado.En este sentido, el Supremo abría la puerta a determinar su competencia para decidir si mantenía o no el tercer grado a los presos concedido por la Generalitat. Por el momento, la Fiscalía decidió recurrir en primera instancia al Juzgado de Vigilancia Penitenciaria y, tras saber la resolución, valorará apelar al Supremo. Además, como medida cautelar, el Ministerio Público ha pedido al juzgado que suspenda la concesión del tercer grado de forma cautelar a estos presos.Poco tiempo en prisiónEn los informes presentados ante el juzgado, la Fiscalía detalla que la mayoría de los internos, como Junqueras o Forcadell, no han cumplido ni una cuarta parte de la condena, por lo que detalla que no se puede ""utilizar la progresión a tercer grado en fases tan iniciales de cumplimiento de la pena, como es el caso, como un modo de alterar la decisión condenatoria de la sentencia y su efectivo cumplimiento"". El Ministerio Fiscal tampoco considera que se han cumplido ""los fines de reeducación y resocialización"", ya que los presos ya estaban integrados en la sociedad antes de cometer el delito. Por eso, la Fiscalía afea a las juntas de tratamiento que sólo contemplen las medidas de ""educación y resocialización"" para la concesión del tercer grado, cuando también es importante ""el carácter retributivo de la pena que descansa, por un lado, en la culpabilidad, y por otro, en la experimentación como algo merecido por el penado y por la sociedad, así como la prevención especial y general"". En este sentido, el fiscal señala que las juntas de tratamiento conceden este tercer grado ya que los internos han sido capaces ""de vivir en sociedad, respetando las normas por el buen uso realizado de las salidas realizadas en virtud del aplicación del régimen flexible del art. 100.2 del Reglamento Penitenciario"". Argumentos de la Fiscalía""En el fondo, lo que late en dicha concepción del derecho penitenciario es la convicción de que éste debe reservarse para sujetos marginales y desfavorecidos, pues los individuos con formación y recursos personales, sociales y familiares siempre están en disposición de integrarse en la sociedad y vivir respetando las normas, pues pueden tener trabajo"", señala el recurso.""Las prematuras clasificaciones en tercer grado producen el menoscabo de los fines esenciales de la pena, que no sólo se concretan en el de reinserción, al no poderse silenciar el retributivo, acorde a la gravedad de la pena, y en función a la deuda contraída por el delincuente respecto a la sociedad en que vive, además de los fines de prevención especial y general"", indica la Fiscalía. Además, detalla que los internos siguen considerando que los hechos de la condena no son delito aunque en los informes de la junta de tratamiento se señala que algunos de ellos, como Junqueras, ""continúa pensando que la vía unilateral impuesta por la fuerza para la creación de una república catalana no es viable"". Para la Fiscalía, este ""continúa"" supone ""que ya antes lo pensaba, sin embargo, y tal como declara probado la sentencia condenatoria, eligió dicha vía para imponer su voluntad en contra del mandato legal y de las advertencias del Tribunal Constitucional, y que considere que dicho camino no es viable no supone en absoluto que no lo considere legítimo, ni mostrando ningún tipo de arrepentimiento por haberlo utilizado"".Junqueras, ""la evolución ha sido nula""En el caso de Junqueras, el fiscal considera que ""la evolución tratamental del interno ha sido nula, tal y como se deriva de la entrevista concedida a TV3 inmediatamente después de ser progresado a tercer grado"", y detalla que en este programa afirmó: ""Ya he dicho, incluso ante el Supremo, que lo que hicimos era fruto de un mandato democrático, de un programa electoral "", o ""mis compromisos los cumplí y estoy orgulloso de lo que hice"", para continuar manifestando que ""él siempre pensó que tenía que cumplir con el mandato democrático, con el mandato del Parlament"", para finalmente afirmar que trabajará ""para que nunca más ni mis hijos ni los hijos de nadie tengan que ir a prisión por defender el derecho a votar de los ciudadanos"".El fiscal cree que el ex vicepresidente de Cataluña ""sigue considerando que los hechos por los que ha sido condenado son mero ejercicio de derechos democráticos, que está orgulloso del delito cometido y que ha ido a prisión por defender el derecho a votar, por lo que él mismo continúa manteniendo todas las distorsiones y déficits que le llevaron a la comisión delictiva"". Y añade que ""el interno mantiene todos los déficits que le llevaron a delinquir, como la falta de respeto a las leyes y a los tribunales de justicia, creencia de un mandato superior del Parlamento de Cataluña por encima del mandato constitucional y de las advertencias del Tribunal Constitucional, así como la creencia de poder arrogarse la capacidad para interpretar la voluntad popular"".Desde la Fiscalía se indica que no les consta más casos de internos en los que el tribunal sentenciador sea el Supremo y que cumplan pena en prisiones de la provincia de Barcelona.Conforme a los criterios deThe Trust ProjectSaber másTribunal SupremoJordi CuixartJordi SànchezÒmnium CulturalRaül RomevaOriol JunquerasANCJosep RullJordi TurullJoaquim FornDolors BassaCarme ForcadellCataluñaSentencia procésTribunalesLos líderes soberanistas presos están a un paso de ir sólo a prisión a dormirTribunalesLa Generalitat pide prisión para procesados por lanzar piedras a Mossos en los disturbios tras la sentencia del 1-O'Procés'Oriol Junqueras reta al Tribunal Supremo con otro referéndum en CataluñaVer enlaces de interésÚltimas noticiasTraductor inglesProgramacionCalendario CatalunyaCalendario laboralHoroscopo diarioClasificacion Liga SantanderCalendario de ligaPeliculas TVTemasfunction doSomething(element){if(element.parentNode.classList.contains(""ue-c-popular-links--closed"")){return openFeaturedLinks(element.parentNode,element,element.parentNode.querySelectorAll(""ul""));}return closeFeaturedLinks(element.parentNode,element,element.parentNode.querySelectorAll(""ul""));}function openFeaturedLinks(element,button,uls){element&&element.classList.toggle(""ue-c-popular-links--closed"");button&&button.setAttribute('aria-expanded','true');let span=button&&button.querySelector(""span"");span.innerHTML=""Cerrar enlaces de inter&eacute;s"";if(uls){uls.forEach((ul)=>{ul&&ul.setAttribute('aria-hidden','false');ul&&ul.classList.remove(""hidden-content"");})}}function closeFeaturedLinks(element,button,uls){element&&element.classList.toggle(""ue-c-popular-links--closed"");button&&button.setAttribute('aria-expanded','false');let span=button&&button.querySelector(""span"");span.innerHTML=""Ver enlaces de inter&eacute;s"";if(uls){uls.forEach((ul)=>{ul&&ul.setAttribute('aria-hidden','true');ul&&ul.classList.add(""hidden-content"");})}}",El juzgado suspende el tercer grado de cinco líderes soberanistas presos por el 'procés',https://www.elmundo.es/cataluna/2020/07/28/5f200572fc6c83be3a8b45b4.html,web-scraper/elmundo,www.elmundo.es,1297,13
08f45aaafb07c46ac8d523f067bd52ac,"Portugal.La Policía lusa revisa pozos del Algarve en busca del cuerpo de Madeleine McCannDesaparición.Investigadores alemanes tienen ""pruebas"" de la muerte de Madeleine McCannInvestigación.La Fiscalía alemana asume que Madeleine McCann está muertaEl caso de Madeleine McCann, la niña británica desaparecida en el Algarve, avanza a toda velocidad. En el marco de su investigación por asesinato contra el pedófilo alemán Christian B. la Fiscalía germana ha ordenado la excavación de una huerta en las cercanías de la ciudad de Hannover en la que han participado un centenar de agentes. Algunos medios de comunicación locales sitúan esa pequeña parcela en las proximidades de una guardería.La Fiscalía alemana no ha precisado las razones de ese rastreo, durante el cual incluso se han cortado varios árboles, para no enturbiar la investigación. La ciudad de Hannover está a unos 65 kilómetros de Braunschweig, donde el sospechoso, actualmente en prisión por un delito de drogas, tenía su última residencia. La parcela se sitúa prácticamente entre una carretera y un río, y en ella hay un pequeño bungalow que fue utilizado como segunda vivienda.""Esta operación está relacionada con la investigación del caso Maddie McCann, pero no habrá detalles sobre el procedimiento que se está llevando a cabo. La policía necesita algo más de tiempo para terminar"", afirmó la portavoz del Ministerio Público, Julia Meyer. En el rastreo de la parcela han participado agentes de la Oficina Federal de lo Criminal y especialistas forenses.Hace apenas dos días, el fiscal encargado del caso, Hans Christian Wolters, reveló que hay pruebas de que las pesquisas en Alemania van en la dirección correcta. A diferencia de Scotland Yard, que sigue investigando el caso por desaparición, los alemanes parten de la base de que la niña está muerta.""Tenemos evidencias concretas pero no evidencias forenses"", afirmó Wolters. El hecho de que efectivos del cuerpo de forenses se sumaran a la excavación de esa huerta cobra en esta operación un significado especial, aunque se desconoce si lo que la policía está buscando son evidencias directas de la desaparición y presunto asesinato de Madeleine, o nuevos indicios contra el sospechoso.Mientras, se acumulan nuevos indicios y testimonios de testigos que vieron o creyeron ver algo. Y van en todas las direcciones. Este fin de semana un diario alemán se hace eco de una entrevista en la televisión portuguesa de una maestra que aseguraba haber reconocido a la niña hace tres o cuatro años en un supermercado de Albufeira, a unos 45 minutos en coche de Praia da Luz, donde fue vista por última vez. Según la docente, la niña tenía una mancha de nacimiento en el ojo derecho, como Maddie, tenía la edad que la británica debía tener en esas fechas, y hablaba con quienes le acompañaban en alemán.Conforme a los criterios deThe Trust ProjectSaber másAlemaniaDesaparecidosSucesosLa Policía rescata en Madrid a un hombre al que el dueño de un bar dejó encerrado por dormirse borrachoCanadáLa Policía Montada detiene a un individuo armado en la residencia del primer ministro Justin TrudeauCoronavirusDenunciado el organizador de un partido de fútbol de infectados contra no infectados en NavarraVer enlaces de interésNoticiasProgramaciónTraductorCalendarioHoroscopoClasificacionCalendario ligaPeliculasTemasfunction doSomething(element){if(element.parentNode.classList.contains(""ue-c-popular-links--closed"")){return openFeaturedLinks(element.parentNode,element,element.parentNode.querySelectorAll(""ul""));}return closeFeaturedLinks(element.parentNode,element,element.parentNode.querySelectorAll(""ul""));}function openFeaturedLinks(element,button,uls){element&&element.classList.toggle(""ue-c-popular-links--closed"");button&&button.setAttribute('aria-expanded','true');let span=button&&button.querySelector(""span"");span.innerHTML=""Cerrar enlaces de inter&eacute;s"";if(uls){uls.forEach((ul)=>{ul&&ul.setAttribute('aria-hidden','false');ul&&ul.classList.remove(""hidden-content"");})}}function closeFeaturedLinks(element,button,uls){element&&element.classList.toggle(""ue-c-popular-links--closed"");button&&button.setAttribute('aria-expanded','false');let span=button&&button.querySelector(""span"");span.innerHTML=""Ver enlaces de inter&eacute;s"";if(uls){uls.forEach((ul)=>{ul&&ul.setAttribute('aria-hidden','true');ul&&ul.classList.add(""hidden-content"");})}}",La Policía alemana excava un jardín para hallar pruebas sobre la desaparición de Madeleine McCann,https://www.elmundo.es/internacional/2020/07/28/5f201a34fdddffb5708b4607.html,web-scraper/elmundo,www.elmundo.es,527,15
e44835e16bd3f61dc2144fac0a756499,"Durante la elaboración de la Constitución, el PSOE, por iniciativa de Gregorio Peces-Barba, tuvo la magnífica idea de convocar el 17 de enero de 1978 a un grupo selecto de catedráticos de Derecho, algunos no socialistas, para que aconsejaran ante la redacción de la Norma Fundamental, que ya estaba muy avanzada. Fue una reunión apasionante y muy provechosa por las ideas o por las críticas que allí se vertieron. Uno de los temas abordados hoy está de actualidad. Quienes dirigieron el debate, se negaron a discutir su significado y, en consecuencia, ahora estamos en el atolladero.Veamos. Un conocido catedrático de Derecho Penal expuso que, desPara seguir leyendo, hazte Premium¿Ya eres Premium? Inicia sesiónMensualOferta de verano1€/mes durante 2 mesesy después 7,99 € Lo quieroAnual4 meses gratis59€Gratis 1 año de Legálitas Estándar (valorado en 240€)Lo quiero Descubre qué es Premium  Cancela cuando quieras   Consulta los términos y condiciones del servicio Conforme a los criterios deThe Trust ProjectSaber más",La confusa inviolabilidad del Rey,https://www.elmundo.es/opinion/2020/07/28/5f1ebaf6fc6c83af098b45d9.html,web-scraper/elmundo,www.elmundo.es,136,5
