uid,body,title,url,newspaper_uid,host,n_tokens_body,n_tokens_title
828119099290eef0967dbe44b853cd65," googletag.cmd.push(function () { googletag.display('div-gpt-ad-deportes_ne_r-prv_5f1b3d4e21efa059568b4601'); }); PREMIUMJAVIER SÁNCHEZ@javisanchezActualizado                         Martes,    28    julio    2020    -         17:15    Compartir en FacebookCompartir en TwitterEnviar por email«A día de hoy aún me pasa y eso que ya tengo unos años. Voy a una carrera popular a algún pueblo y sólo por apellidarme Antón ya creen que ganaré. La gente me ve como el favorito y, si quedo segundo, suponen que he tenido un mal día. En realidad, no me conocen, sólo esperan que sea mi hermano Abel», relata Carmelo Antón, que tiene un palmarés notable. De joven disputó campeonatos de España, el atletismo le sirvió para entrar en los Bomberos de Almazán, donde hoy es jefe del parque, y a los 55 años todavía disfruta del correr: llegó a ser subcampeón del mundo de veteranos de 1.500 metros. ¿Su problema? Su hermano Abel Antón fue dos veces campePara seguir leyendo, hazte Premium¿Ya eres Premium? Inicia sesiónMensualOferta de verano1€/mes durante 2 mesesy después 7,99 € Lo quieroAnual4 meses gratis59€Gratis 1 año de Legálitas Estándar (valorado en 240€)Lo quiero Descubre qué es Premium  Cancela cuando quieras   Consulta los términos y condiciones del servicio Conforme a los criterios deThe Trust ProjectSaber más","La vida del hermano pequeño de una leyenda: ""Hay que ser tonto para no ver la diferencia entre los superdotados y el resto""",https://www.elmundo.es/deportes/motociclismo/2020/07/28/5f1b3d4e21efa059568b4601.html,web-scraper/elmundo,www.elmundo.es,158,21
297f87b13de1b0c5052a95612f9ce7ba,"                        SALUD.                                            Médicos denuncian una campaña para saturar la Sanidad y no usar mascarilla                    El golpe propinadopor  la pandemia de coronavirus y las medidas de confinamiento decretadas para frenarla sobre el mercado laboral que ha no tiene precedentes. Ni siquiera en la gran crisis de 2008 se produjo un periodo de destrucción de empleo tan intenso. En el segundo trimestre del año la destrucción de empleo afectó a 1.074.000 personas, según los datos de la Encuesta de Población Activa elaborada por el Instituto Nacional de Estadística )INE). Los datos incluyen numerosas salvedades ya que, por ejemplo, no incluyen  a los más de tres millones de afectados por un Expediente de Regulación Temporal de Empleo (ERTE) que se registraron el pasado mes de abril, que debido a que mantienen su empleo en suspenso se consideran ocupados a efectos estadísticos. Los registros de actividad laboral llevados a cabo por el INE reflejan uno de los trimestres más anómalos de su historia. Por ejemplo, un dato que refleja el carácter de la hibernación de la economía decretada a partir del estado de alarma es que apenas una de cada tres personas en edad de trabajar trabajó efectivamente (13,9 millones). La tasa de paro ha vuelto a superar el 15% con un aumento de 55.000 personas, un dato que no refleja ni someramente el impacto de la crisis y que se explica, por un lado, por el efecto de los ERTE y, por otro, por el hecho de que más de un millón de personas (1.062.800) han abandonado directamente el mercado de trabajo respecto al trimestre anterior.  "" No todos los que perdieron su empleo en este periodo pasaron a clasificarse como parados, pues una parte considerable pasaron a considerarse inactivos"", explica el INE.Además, el organismo señala que el bloqueo de la movilidad por motivos de fuerza mayor llevó a que 1.628.500 personas tampoco pudieran buscar empleo a pesar de estar disponibles para trabajar. ""Con ello no han cumplido todas las condiciones que la definición OIT exige para ser clasificado como parado"", explica el INE. Esta cifra supone un incremento de 843.000 personas respecto del trimestre anterior.Por territorios, las mayores cifras de destrucción de empleo se han producido en Andalucía, (226.800), Cataluña (-203.600) y Comunidad Valenciana (-140.600). En cuanto al reparto en el impacto laboral de la crisis causada por el coronavirus, el sector privado ha sido el que lo ha absorbido prácticamente en su totalidad. Sólo en el trimestre el sector público ha destruido 22.000 empleos mientras que en el privado han desaparecido 1.052.000. Si la comparación se lleva al mismo trimestre de 2019, el empleo se ha incrementado en 31.500 personas en el sector público y ha bajado en 1.229.100 en el privado. Si pudiera trazarse un perfil de las personas afectadas por la destrucción de empleo a partir de las categorías que encabezan las estadísticas podría decirse que esas personas son jóvenes con empleos temporales (un 80% del empleo destruido) y en el sector de la hostelería, que es el que más ha sufrido el efecto de la pandemia.  Son datos que, en opinión de Unai Sordo, líder de CCOO, revelan la gravedad real de la crisis y anticipan un otoño muy difícil. Sordo ha señalado que será imprescindible hacer cambios en la reforma laboral de 2012 si se quiere evitar una intensa devaluación salarial. En el seno del Gobierno, la conveniencia de afrontar esta reforma es objeto de constante debate. Si la responsable de Trabajo, Yolanda Díaz, hace entender que cumplirá con su compromiso de derogación, desde Economía, Nadia Calviño, opina lo contrario.""Desgraciadamente no hemos alcanzado la cima y esta situación seguirá pasando una dura factura sobre el empleo en los próximos meses. El otoño y el invierno van a ser muy duros y esto se reflejará en el empleo y en la destrucción de empresas"", ha señalado Lorenzo Amor, presidente de la Asociación de Trabajadores Autónomos (ATA) .Conforme a los criterios deThe Trust ProjectSaber másINEYolanda DíazNadia CalviñoAndalucíaComunidad ValencianaCataluñaCCOOParoEmpleoTurismoTormenta perfecta en verano: Reino Unido es el país que más gasta y Cataluña la comunidad que más recibeContagiosEl mapa de los rebrotes de Covid-19 en España: detectan un brote en Boiro al dar positivo una familia procedente de MadridLaboralEmpresarios y sindicatos ven ya inevitable una nueva prórroga de los ERTE en septiembre para proteger trabajadores y empresasVer enlaces de interésUltimas noticiasProgramaciónTraductor inglesCalendario laboralHoroscopo diarioClasificacion Liga SantanderCalendario de ligaPeliculas TVNotas corte 2019Temas	function doSomething(element) {        if (element.parentNode.classList.contains(""ue-c-popular-links--closed"")) {            return openFeaturedLinks(element.parentNode, element, element.parentNode.querySelectorAll(""ul""));        }        return closeFeaturedLinks(element.parentNode, element, element.parentNode.querySelectorAll(""ul""));    }	function openFeaturedLinks(element, button, uls) {		element && element.classList.toggle(""ue-c-popular-links--closed"");		button && button.setAttribute('aria-expanded', 'true');		let span = button && button.querySelector(""span"");		span.innerHTML = ""Cerrar enlaces de inter&eacute;s"";		if ( uls ) {			uls.forEach((ul) => {				ul && ul.setAttribute('aria-hidden', 'false');				ul && ul.classList.remove(""hidden-content"");			})		}	}	function closeFeaturedLinks(element, button, uls) {		element && element.classList.toggle(""ue-c-popular-links--closed"");		button && button.setAttribute('aria-expanded', 'false');		let span = button && button.querySelector(""span"");		span.innerHTML = ""Ver enlaces de inter&eacute;s"";		if ( uls ) {			uls.forEach((ul) => {				ul && ul.setAttribute('aria-hidden', 'true');				ul && ul.classList.add(""hidden-content"");			})		}			}",La destrucción de empleo causada por el coronavirus y la hibernación económica bate todos los registros,https://www.elmundo.es/economia/2020/07/28/5f1fceacfdddff39a78b4574.html,web-scraper/elmundo,www.elmundo.es,723,15
1657390cb69c2723f9fb6b61d7550d35,"Abalde.Un fichaje estratégicoJoventut.De la bancarrota al fichaje de TomicSe podría intuir un mercado de cinturones apretados, un horizonte frugal para el baloncesto nacional, un 'me quedo como estoy' teniendo en cuenta el panorama generado por la pandemia de coronavirus, la incertidumbre económica general y los apuros que acechan a tantos clubes. Y, sin embargo, tras la fulgurante, sorprendente y exitosa Fase Final de la Liga Endesa, se ha desatado un incontenible ir y venir de jugadores, renovaciones, fichajes y rumores que atisban una ACB al alza para el próximo curso. Pero, ¿es oro todo lo que reluce?«Se ha gastado más dinero que otros veranos, seguro. Y no deja de ser llamativo», pronuncia Guillermo Bermejo, Para seguir leyendo, hazte Premium¿Ya eres Premium? Inicia sesiónMensualOferta de verano1€/mes durante 2 mesesy después 7,99 € Lo quieroAnual4 meses gratis59€Gratis 1 año de Legálitas Estándar (valorado en 240€)Lo quiero Descubre qué es Premium  Cancela cuando quieras   Consulta los términos y condiciones del servicio Conforme a los criterios deThe Trust ProjectSaber más","El desatado mercado de fichajes de la ACB: ""Se ha gastado más dinero. Es raro""",https://www.elmundo.es/deportes/baloncesto/liga-endesa/2020/07/28/5f1eea63fdddff56638b4607.html,web-scraper/elmundo,www.elmundo.es,145,15
d1e45c44f52d91964734f4cef0d177ec,"Mía, la única hija del golfista colombiano Camilo Villegas y su esposa, María, falleció el domingo con sólo 22 meses en Miami después de luchar contra tumores en el cerebro y la columna vertebral, informa este lunes el PGA Tour. ""El PGA TOUR está profundamente apenado por haber perdido a un miembro de nuestra familia, Mia Villegas"", señala en la web del circuito su comisionado, Jay Monahan. ""Estamos de luto junto a Camilo y María y nuestros pensamientos y oraciones están con la familia Villegas"", agrega. Villegas, cuatro veces ganador en el PGA Tour, habló de los problemas de salud de su hija el mes pasado durante una emotiva conferencia de prensa antes del Korn Ferry Challenge en el TPC Sawgrass. En ese momento, dijo que él y su esposa María notaron por primera vez un problema con Mía a finales de febrero mientras el colombiano disputaba el Honda Classic. ""Ella siempre iba al gimnasio conmigo; era uno de nuestros puntos de unión"", recordó Villegas. ""Ella siempre era como un monito, trepando en todo. Pero un día me di cuenta de que no trepaba en nada. También había estado llorando un poco más de lo normal por la noche. Le habían salido los dientes, así que la llevamos al pediatra, pensando que era eso"", explicó aquel día. Cerebro y columnaEl 14 de marzo, los Villegas llevaron a Mía al Hospital Infantil Nicklaus de Miami para que la sometieran a un escáner. Los resultados revelaron tumores que crecían en el cerebro y en la columna vertebral. Mía fue operada, pero a Camilo y María se les dijo que habría más tratamiento por venir, debido a problemas persistentes. ""Después de la cirugía, cuando llegó el momento de retirar los puntos, se dieron cuenta de que el crecimiento se había vuelto bastante agresivo"", dijo. ""Nos dijeron que teníamos que empezar el tratamiento de inmediato, así que nos mantuvieron allí. Físicamente, sin embargo, no estaba lista para recibir el tipo de quimio que los médicos esperaban"", agregó Villegas. La alternativa se convirtió en lo que Villegas se refirió como ""quimioterapia para bebés"". Recuerda haberle preguntado al doctor sobre la fuerza de este tratamiento para su hija. ""Dijo que si le hubieran dado el tratamiento, no habría sobrevivido"", dijo Villegas. ""No es fácil, pero he visto a Mía jugando mientras llora"", dijo Villegas. ""Ella quiere jugar. Es una niña. Es joven e ingenua, pero también es muy dura. Simplemente no lo sabemos. Los médicos explicaron que a veces los tumores crecen y desaparecen rápidamente"", agregó. Villegas no ha jugado desde que terminó en el puesto trigésimo tercero en un torneo del Korn Ferry Tour en junio.Conforme a los criterios deThe Trust ProjectSaber másgolfdeportescáncerGolfAsí se forjó Jon Rahm, un insólito número uno del mundo: ""He dejado a mi hijo en un avión y no sé ni dónde va""CiclismoUna Vuelta a Burgos contra el pesimismo: pelotón de lujo y aforo limitadoRyder CupLa Ryder Cup se aplaza a septiembre de 2021 por el coronavirusVer enlaces de interésUltima horaTraductor españolProgramaciónCalendario 2020Horoscopo hoyClasificacion ligaCalendario Liga SantanderPeliculas hoyTemasfunction doSomething(element){if(element.parentNode.classList.contains(""ue-c-popular-links--closed"")){return openFeaturedLinks(element.parentNode,element,element.parentNode.querySelectorAll(""ul""));}return closeFeaturedLinks(element.parentNode,element,element.parentNode.querySelectorAll(""ul""));}function openFeaturedLinks(element,button,uls){element&&element.classList.toggle(""ue-c-popular-links--closed"");button&&button.setAttribute('aria-expanded','true');let span=button&&button.querySelector(""span"");span.innerHTML=""Cerrar enlaces de inter&eacute;s"";if(uls){uls.forEach((ul)=>{ul&&ul.setAttribute('aria-hidden','false');ul&&ul.classList.remove(""hidden-content"");})}}function closeFeaturedLinks(element,button,uls){element&&element.classList.toggle(""ue-c-popular-links--closed"");button&&button.setAttribute('aria-expanded','false');let span=button&&button.querySelector(""span"");span.innerHTML=""Ver enlaces de inter&eacute;s"";if(uls){uls.forEach((ul)=>{ul&&ul.setAttribute('aria-hidden','true');ul&&ul.classList.add(""hidden-content"");})}}",Muere la hija de dos años del golfista Camilo Villegas por un cáncer cerebral,https://www.elmundo.es/deportes/golf/2020/07/28/5f1fd52e21efa075608b4598.html,web-scraper/elmundo,www.elmundo.es,517,14
afda3bf2e4aef59339bf06f93d6a54e1," googletag.cmd.push(function () { googletag.display('div-gpt-ad-espana_ne_r-prv_5f1f19c4fc6c8393528b461a'); }); PREMIUMRICARDO F. COLMENERO@rfcolmenero77IbizaActualizado                         Lunes,    27    julio    2020    -         22:27    Compartir en FacebookCompartir en TwitterEnviar por email                        Baleares.                                            El castellano desaparece de la enseñanza Infantil y Primaria                                            Universidad.                                            El Govern balear defiende el contenido catalanista en Selectividad                    El Ministerio de Educación, a través de la Alta Inspección Educativa de Baleares, ha rechazado instar al Gobierno balear a que el castellano sea lengua vehicular en las islas, o que al menos los niños puedan tener un mínimo de un 25% de clases en esta lengua. ""La normativa actual no indica que la proporción mínima del castellano en los proyectos lingüísticos de los centros públicos sostenidos con fondos públicos deba ser de un 25%"", respondió Isabel García Sureda, directora de la Alta Inspección balear, a la reclamación de los profesores de la plataforma PLIS Educación (Profesores Libres de Ingeniería Social). Y eso que los profesores habíaPara seguir leyendo, hazte Premium¿Ya eres Premium? Inicia sesiónMensualOferta de verano1€/mes durante 2 mesesy después 7,99 € Lo quieroAnual4 meses gratis59€Gratis 1 año de Legálitas Estándar (valorado en 240€)Lo quiero Descubre qué es Premium  Cancela cuando quieras   Consulta los términos y condiciones del servicio Conforme a los criterios deThe Trust ProjectSaber más",Isabel Celaá rechaza que los niños de Baleares tengan al menos un 25% de clases en castellano,https://www.elmundo.es/espana/2020/07/27/5f1f19c4fc6c8393528b461a.html,web-scraper/elmundo,www.elmundo.es,171,16
62401013b71ac0edc4066d029f8d3aa9,"1-0 en el Pizjuán.El Valencia completa el esperpentoUn hombre discreto, empeñado en entrar en la mente de los jugadores y que no rehúye los retos. Javi Gracia (Pamplona, 1970) coge las riendas del Valencia casi sin hacer ruido, pero con un bagaje en sus alforjas que no alimenta desconfianzas. Hace tres años ya estuvo en la agenda de Mateu Alemany mientras sufría el duro invierno en Rusia y desde entonces ha probado en la Premier League, donde llevó al Watford hasta la final de Copa. A Mestalla llega aún más maduro. ¿Lo conocía Peter Lim? No, pero los informes que ha ido recabando desde Singapur le dibujaron un perfil en el que confía.Como futbolista y como técnico, Gracia ha trotado por medio mundo buscando vivir de su pasión y combinando las dos caras que le ha enseñado el fútbol. Se rehízo de la frustración de no jugar en el Athletic, donde se formó, para disfrutar del ascenso a Primera del Lleida, de su notable paso por Valladolid y Real Sociedad y de sus buenos momentos en un Villarreal que despegaba. En el banquillo se estrenó con mariscadas en Pontevedra, le dejaron a deber en el Cádiz, al que devolvió a Segunda, y vio el fútbol corrupto por dentro en el Olympiakos y el Kerkyra griegos. Al Almería llegó como alter ego de Unai Emery y colocó al equipo en Primera, antes de que la temporada siguiente se martirizara con el descenso de Osasuna. Nunca vistió la camiseta rojilla, pero sus ídolos en los cromos de los 80 fueron Echeverria, Iriguibel y Martín.Adaptación camaleónicaDe aquel varapalo se recuperó en Málaga, ya cuando Al Thani se batía en retirada tras los alardes europeos. Dirigió al equipo dos temporadas en las que rozó Europa y que aumentaron su cartel. Así, volvió a arrastrar su maleta hasta el Rubin Kazan. El invierno ruso le golpeó tan fuerte que aguantó sólo una campaña y se volvió a casa. De allí lo sacó el Watford de la familia Pozzo, que le encomendó salvar al equipo y él respondió llevándolo a la final de la FA Cup. Le renovaron hasta 2023, pero el idilio se rompió con una inesperada destitución el pasado septiembre.Si hay un valor que Gracia luce es una adaptación camaleónica. Con trazo grueso, su principio es la solidez defensiva con un 4-4-2, pero sin mermar la creatividad. La estadística de ataque de sus equipos lo corrobora. A eso suma su capacidad para radiografiar de las plantillas y llegar a la mente de los jugadores, con mano suave pero principios firmes. «El fútbol es de los jugadores, yo solo los organizo» es uno de sus mantras. Para eso persevera en sus explicaciones y razonamientos hasta conseguir que entiendan que lo que les pide en el campo los va a hacer mejores, a ellos y al equipo. Es la forma en que se gana su respeto.Después llega el análisis del entorno, de la idiosincrasia del club y de sus aficionados. «Hay que tener una visión rápida», dice. Por eso domina el inglés lo suficiente como para haber lidiado con propietarios rusos, árabes o griegos, más o menos caprichosos e intervencionistas, sin que saltaran chispas. Eso es algo que ha valorado Peter Lim y, sobre todo, su entorno. Necesitaban un carácter templado, pero con amplia experiencia. Mano de acero en guante de seda. Su nuevo entrenador tiene las obsesiones de todo preparador moderno: nutrición, análisis de vídeo, desarrollo y calidad de los entrenamientos... y una disciplina basada en el respeto al trabajo de los demás, con multas significativas ante la menor impuntualidad.Rebajar el coste salarialSu primer reto será recuperar el concepto de familia que tenía el vestuario del Valencia, la confianza ajada en el último año que ha hecho peores a los futbolistas. Pero, antes, el club hará purga para rebajar el coste salarial en, al menos, 60 millones, algo que Gracia sabe y acepta.Además de su bagaje y su carácter, el navarro ha tenido valedores que han transmitido su buen hacer. En la secretaría técnica del Valencia sobreviven Miguel Ángel Corona e Ibán Andrés. A ambos los conoció en el Almería. Corona era el capitán del equipo y Andrés formó parte de su cuerpo técnico como analista táctico. Los dos han transmitido las bondades de Gracia al presidente, Anil Murthy.Gracia se ha impuesto a tres rivales: José Bordalás, Laurent Blanc y Rubén Baraja. El primero era el favorito, perfecto para Mestalla, pero su compromiso con el Getafe y su cláusula de rescisión fueron los frenos. El francés, recomendado por el dueño del PSG, lleva cuatro años alejado de los banquillos y nunca ha entrenado en LaLiga. En el caso del ex valencianista, libre tras dejar el Tenerife, ha pesado que no tiene experiencia en Primera y la situación del club no es la más idónea para rodarse.Conforme a los criterios deThe Trust ProjectSaber másReal SociedaddeportesUD AlmeríaReal Valladolid CFPremier LeaguefútbolValencia CFPrimera DivisiónSegundaLa 'crisis de los avales' que ahora hace soñar al Deportivo: del ""capullos"" de Caneda al papel ""decisivo"" de Felipe GonzálezLaLigaEl Villarreal sueña a lo grande ante un Valencia sumido en la depresiónFútbolMessi paraliza su renovación y acorrala a BartomeuVer enlaces de interésUltima horaTraductor españolProgramaciónCalendario 2020Horoscopo hoyClasificacion ligaCalendario Liga SantanderPeliculas hoyTemasfunction doSomething(element){if(element.parentNode.classList.contains(""ue-c-popular-links--closed"")){return openFeaturedLinks(element.parentNode,element,element.parentNode.querySelectorAll(""ul""));}return closeFeaturedLinks(element.parentNode,element,element.parentNode.querySelectorAll(""ul""));}function openFeaturedLinks(element,button,uls){element&&element.classList.toggle(""ue-c-popular-links--closed"");button&&button.setAttribute('aria-expanded','true');let span=button&&button.querySelector(""span"");span.innerHTML=""Cerrar enlaces de inter&eacute;s"";if(uls){uls.forEach((ul)=>{ul&&ul.setAttribute('aria-hidden','false');ul&&ul.classList.remove(""hidden-content"");})}}function closeFeaturedLinks(element,button,uls){element&&element.classList.toggle(""ue-c-popular-links--closed"");button&&button.setAttribute('aria-expanded','false');let span=button&&button.querySelector(""span"");span.innerHTML=""Ver enlaces de inter&eacute;s"";if(uls){uls.forEach((ul)=>{ul&&ul.setAttribute('aria-hidden','true');ul&&ul.classList.add(""hidden-content"");})}}","Javi Gracia, un diplomático trotamundos para tiempos de estrecheces en Mestalla",https://www.elmundo.es/deportes/futbol/2020/07/28/5f1f4a1721efa04a268b4592.html,web-scraper/elmundo,www.elmundo.es,843,11
