uid,body,title,url,newspaper_uid,host,n_tokens_body,n_tokens_title
d1c289198acd26340971b81c0272e8e0,"Directo.Coronavirus España hoy, última hora en directoFernando Simón.""Que Reino Unido exija cuarentena nos favorece. Es un riesgo que nos quitan""Alemania.Desaconseja a sus ciudadanos viajar a Cataluña, Aragón y NavarraLa Mesa del Turismo, asociación que representa a empresarios y profesionales del sector, ha pedido hoy la dimisión del director del Centro de Coordinación de Alertas y Emergencias Sanitarias, Fernando Simón, después de que éste ayer asegurara que es mejor que los ciudadanos de Bélgica, cuyo Gobierno les ha recomendado no visitar España, no vengan porque es un ""riesgo que nos quitan"". Del mismo modo, se pronunció respecto a la cuarentena de 14 días que ha impuesto Reino Unido a todos sus ciudadanos que hayan estado en España. ""Desde el punto de vista sanitario estas decisiones nos ayudan, y es un riesgo que nos quitan"", dijo Simón.Estas apreciaciones han sido criticadas por la Mesa del Turismo, que cree que Simón ""celebra así la ruina del sector"". El turismo es el motor económico de España, y supone casi el 13% del PIB y el 13% del empleo del país.""Las palabras pronunciadas por el director del Centro de Coordinación de Alertas y Emergencias Sanitarias ayer manifestando que se muestra agradecido con los países que han decidido no traer turistas a España han indignado profundamente a la Mesa de Turismo"", han señalado en un comunicado.La Mesa del Turismo cree que las declaraciones del epidemiólogo ""son ya totalmente intolerables"". La Mesa ha recordado que, de no tomarse medidas inmediatas, la paralización del sector puede suponer la pérdida de más de 90.000 millones de euros a finales de septiembre, pero podrían alcanzarse hasta 120.000 millones de euros de pérdidas y la destrucción de cerca de 1,5 millones de empleos a final del año 2020.Exceltur, que representa a las principales empresas del sector turístico, también ha lamentado las declaraciones de Simón,""alegrándose y agradeciendo las a su decir, muy acertadas decisiones tomadas por Bélgica y Reino Unido"", a pesar ""del descalabro que generará para el turismo y el empleo"" y los más de 10.000 millones de pérdidas de valor, que ha supuesto a las empresas turísticas españolas cotizadas en bolsa.""Nunca nos habíamos sentido más desamparados por una persona, que en sus intervenciones en nombre del Gobierno de España, avalase la sinrazón de unas decisiones externas que afectan al turismo, en parte causadas por unas explicaciones oficiales mal expuestas"", señala.Conforme a los criterios deThe Trust ProjectSaber másEspañaFernando SimónReino UnidoBélgicaTurismoeconomíaCoronavirusCovid 19InvestigaciónUna filtración de la mayor empresa de transfusiones desvela 36.000 percances en 40 paísesSaludCinco muertos por coronavirus en España y 134 nuevos casos en las últimas 24 horasTurismoTUI suspende también sus paquetes a España hasta el 9 de agosto excepto a las islasVer enlaces de interésNoticiasTraductorProgramacionCalendarioHoroscopoClasificacionCalendario ligaPeliculasTemasfunction doSomething(element){if(element.parentNode.classList.contains(""ue-c-popular-links--closed"")){return openFeaturedLinks(element.parentNode,element,element.parentNode.querySelectorAll(""ul""));}return closeFeaturedLinks(element.parentNode,element,element.parentNode.querySelectorAll(""ul""));}function openFeaturedLinks(element,button,uls){element&&element.classList.toggle(""ue-c-popular-links--closed"");button&&button.setAttribute('aria-expanded','true');let span=button&&button.querySelector(""span"");span.innerHTML=""Cerrar enlaces de inter&eacute;s"";if(uls){uls.forEach((ul)=>{ul&&ul.setAttribute('aria-hidden','false');ul&&ul.classList.remove(""hidden-content"");})}}function closeFeaturedLinks(element,button,uls){element&&element.classList.toggle(""ue-c-popular-links--closed"");button&&button.setAttribute('aria-expanded','false');let span=button&&button.querySelector(""span"");span.innerHTML=""Ver enlaces de inter&eacute;s"";if(uls){uls.forEach((ul)=>{ul&&ul.setAttribute('aria-hidden','true');ul&&ul.classList.add(""hidden-content"");})}}","La Mesa del Turismo pide la dimisión de Fernando Simón por ""celebrar la ruina del sector""",https://www.elmundo.es/espana/2020/07/28/5f1ffc24fc6c83855d8b45a2.html,web-scraper/elmundo,www.elmundo.es,448,16
ae630c57c21d77e1dd1a9fe94e22281c," googletag.cmd.push(function () { googletag.display('div-gpt-ad-papel_lideres_ne_r-prv_5f1b150621efa07a238b45bf'); }); PREMIUMRAFA LATORRE@rlatorregMadridActualizado                         Lunes,    27    julio    2020    -         22:21    Compartir en FacebookCompartir en TwitterEnviar por email                        Yascha Mounk.                                            ""Los jóvenes tienen menos miedo a la dictadura que los viejos""                                            Mark Leonard.                                            ""Si los europeos no encontramos maneras de trabajar juntos, nos hundiremos juntos""                    Desde Washington, donde reside, el escritor y analista venezolano Moisés Naím vigila el efecto que la pandemia está teniendo sobre el poder. Lleva la cuenta de aquellos países donde un brote de autoritarismo amenaza la democracia. Le asombra lo violento del contraste entre la gravedad de los desafíos y la talla minúscula del liderazgo mundial. Naím está pendiente de todos aquellos fenómenos relevantes que están produciéndose en este momento y que la enfermedad no deja ver. Entre ellos una plaga de langostas más jóvenes y rápidas de la que no parece haberse enterado nadie. Como opositor al chavismo, asiste con preocupación al viraje de la poPara seguir leyendo, hazte Premium¿Ya eres Premium? Inicia sesiónMensualOferta de verano1€/mes durante 2 mesesy después 7,99 € Lo quieroAnual4 meses gratis59€Gratis 1 año de Legálitas Estándar (valorado en 240€)Lo quiero Descubre qué es Premium  Cancela cuando quieras   Consulta los términos y condiciones del servicio Conforme a los criterios deThe Trust ProjectSaber más","Moisés Naím: ""España es la guarida de los ladrones del chavismo""",https://www.elmundo.es/papel/lideres/2020/07/27/5f1b150621efa07a238b45bf.html,web-scraper/elmundo,www.elmundo.es,179,11
c8eaeab4ec43256c85549fb631fd7cdc,"Hay ingenuos que creen que estos lances tan desagradables servirán para que Juan Carlos Monedero extraiga una enseñanza. Lo único que en la galaxia Podemos le oponen a la violencia política es que ellos no se la merecen. El problema del repudio, la agresión, el acoso o el boicot, no es, para los Monedero, metodológico sino teleológico. El propósito es lo fundamental.La convivencia es un concepto algo más elevado que el de compartir un espacio físico. Es, como mínimo, la asunción de unas normas que le arrebaten el arbitrio a la fuerza. Ese es el principio de todo para un paisano normal -que viene de norma-. Un Monedero cree que antes de nada Para seguir leyendo, hazte Premium¿Ya eres Premium? Inicia sesiónMensualOferta de verano1€/mes durante 2 mesesy después 7,99 € Lo quieroAnual4 meses gratis59€Gratis 1 año de Legálitas Estándar (valorado en 240€)Lo quiero Descubre qué es Premium  Cancela cuando quieras   Consulta los términos y condiciones del servicio Conforme a los criterios deThe Trust ProjectSaber más",No tan mal plan,https://www.elmundo.es/opinion/columnistas/2020/07/28/5f1ee033fdddffb0b08b4628.html,web-scraper/elmundo,www.elmundo.es,147,3
a77b768776334495b7ad44f5de907451,"Uno de los datos más escalofriantes que deja la Encuesta de Población Activa del segundo trimestre es el número de inactivos en España. Se trata, según la definición oficial, del colectivo de más de 16 años que ni tienen trabajo ni lo buscan o pueden buscar activamente.La destrucción de empleo que ha desatado la crisis derivada de la pandemia unida a la dificultad de buscar otro puesto de trabajo en el estado de alarma elevó entre abril y junio el número de personas oficialmente inactivas en nada menos que 1,06 millones de personas.Con este salto, el número de personas inactivas en España de más de 16 años llega ya a 17,58 millones, un réPara seguir leyendo, hazte Premium¿Ya eres Premium? Inicia sesiónMensualOferta de verano1€/mes durante 2 mesesy después 7,99 € Lo quieroAnual4 meses gratis59€Gratis 1 año de Legálitas Estándar (valorado en 240€)Lo quiero Descubre qué es Premium  Cancela cuando quieras   Consulta los términos y condiciones del servicio Conforme a los criterios deThe Trust ProjectSaber más","España alcanza un récord insoportable de personas inactivas: 17,5 millones",https://www.elmundo.es/economia/2020/07/28/5f1fe08bfdddff80848b45da.html,web-scraper/elmundo,www.elmundo.es,145,9
a3d3ed90b96d25fc9134adfb2cdee8b2," googletag.cmd.push(function () { googletag.display('div-gpt-ad-economia_ne_r-prv_5f1f1d9a21efa027488b45ce'); }); PREMIUMDANIEL VIAÑA@DanielVianaRMadridActualizado                         Martes,    28    julio    2020    -         01:33    Compartir en FacebookCompartir en TwitterEnviar por email                        Economistas para la Reconstrucción (IX).                                            Xavier Freixas: ""La crisis del Covid va a acelerar los despidos en la banca""                                            Economistas para la Reconstrucción (VIII).                                            J. Enrique Devesa: ""Nos vamos a ver abocados a recortar pensiones y sueldos de funcionarios""                    Miguel Otero (Basilea, 1979) es doctor en Economía Política por la Universidad de Oxford Brookes, investigador principal del Real Instituto Elcano y formó parte del comité de sabios que asesoró al Gobierno en el proceso de desescalada. La UE y su unión monetaria es uno de sus principales ámbitos de especialización, y desde esa posición sostiene que Merkel es la figura política más relevante en la historia reciente de Europa y que en el gran acuerdo europeo Sánchez mantuvo una posición propia de España: ""El país es muy europeísta pero no propone, no lidera"".Todos los países afirman que han ganado con el acuerdo firmado en Europa. ¿Cómo es pPara seguir leyendo, hazte Premium¿Ya eres Premium? Inicia sesiónMensualOferta de verano1€/mes durante 2 mesesy después 7,99 € Lo quieroAnual4 meses gratis59€Gratis 1 año de Legálitas Estándar (valorado en 240€)Lo quiero Descubre qué es Premium  Cancela cuando quieras   Consulta los términos y condiciones del servicio Conforme a los criterios deThe Trust ProjectSaber más","Miguel Otero: ""Holanda quiere que los países del sur sean prósperos, no imponer austeridad y que nos vaya mal""",https://www.elmundo.es/economia/macroeconomia/2020/07/28/5f1f1d9a21efa027488b45ce.html,web-scraper/elmundo,www.elmundo.es,189,17
a1ec9e00e30a63cefe6b977bb42dc7fb,"Mariano Díaz, delantero de la primera plantilla del Real Madrid de fútbol, ha dado positivo por Covid-19 en los controles a los que fueron sometidos los jugadores este lunes, a la vuelta de su semana de vacaciones tras el fin del campeonato liguero.El jugador ha quedado aislado en su casa y no ha participado en el entrenamiento de este martes. Su presencia en el partido de Champions League contra el Manchester City , el próximo 7 de agosto (vuelta de los octavos de final), queda descartada.El resto de jugadores del Real Madrid han dado negativo en los controles y todos se encuentran en perfecto estado. El club, siguiendo las directrices del doctor Mihic, jefe de los Servicios Médicos, decidió que los tests de todo el primer equipo se realzaran de forma individual en sus respectivos domicilios. Así, resultaba imposible tanto el contacto previo como el posterior hasta conocer los resultados.""Agradezco mucho vuestro mensajes de apoyo. Estoy perfectamente y, gracias a Dios, mi familia y mi entorno también está genial. Ahora estoy confinado en casa y espero volver pronto a la normalidad y estar con mis compañeros"", ha declarado el ex de Espanyol y Olympique de Lyon en sus redes sociales.El jugador de origen dominicano no había contado demasiado en los planes de Zinedine Zidane tras la reanudación de la Liga. En la última cita que compareció fue ante el Getafe, apenas un minuto el pasado 2 de julio. Antes también había participado testimonialmente en los duelos contra la Real Sociedad y el Mallorca.En el parte médico que ha emitido el Real Madrid se detalla la situación de Mariano: ""Tras los tests de COVID-19 realizados de manera individualizada a nuestra primera plantilla de fútbol por los Servicios Médicos del Real Madrid, nuestro jugador Mariano ha dado resultado positivo. El jugador se encuentra en perfecto estado de salud y cumpliendo el protocolo sanitario de aislamiento en su domicilio"".El contagio de Mariano, pues, se produjo durante sus días de asueto y, por tanto, no ha tenido contacto con ninguno de sus compañeros ni miembros del club blanco. El delantero estuvo en el banquillo durante el último partido liguero, ante el Leganés. Pero entonces dio negativo en los test de Covid-19.Conforme a los criterios deThe Trust ProjectSaber másReal MadriddeportesChampions League 2020Tres semanas para preparar la proeza ante el City: ""Este Madrid nunca se conforma""Champions League 2019 - 2020Sorteo Champions League, en directoLaLiga Santander 2019 - 2020Benzema abre el cielo con el tacónVer enlaces de interésUltima horaTraductor españolProgramaciónCalendario 2020Horoscopo hoyClasificacion ligaCalendario Liga SantanderPeliculas hoyTemasfunction doSomething(element){if(element.parentNode.classList.contains(""ue-c-popular-links--closed"")){return openFeaturedLinks(element.parentNode,element,element.parentNode.querySelectorAll(""ul""));}return closeFeaturedLinks(element.parentNode,element,element.parentNode.querySelectorAll(""ul""));}function openFeaturedLinks(element,button,uls){element&&element.classList.toggle(""ue-c-popular-links--closed"");button&&button.setAttribute('aria-expanded','true');let span=button&&button.querySelector(""span"");span.innerHTML=""Cerrar enlaces de inter&eacute;s"";if(uls){uls.forEach((ul)=>{ul&&ul.setAttribute('aria-hidden','false');ul&&ul.classList.remove(""hidden-content"");})}}function closeFeaturedLinks(element,button,uls){element&&element.classList.toggle(""ue-c-popular-links--closed"");button&&button.setAttribute('aria-expanded','false');let span=button&&button.querySelector(""span"");span.innerHTML=""Ver enlaces de inter&eacute;s"";if(uls){uls.forEach((ul)=>{ul&&ul.setAttribute('aria-hidden','true');ul&&ul.classList.add(""hidden-content"");})}}","Mariano, del Real Madrid, positivo por Covid-19",https://www.elmundo.es/deportes/futbol/primera-division/2020/07/28/5f200ca9fdddff07b08b457c.html,web-scraper/elmundo,www.elmundo.es,433,6
0462f766a52ab5f86db590f1f6f2407c,"Apps.Todos los trucos para que nadie sepa si ya has leído sus whatsappWhatsApp, Instagram y Facebook (las dos primeras son propiedad de la última) han experimentado un fallo que ha hecho que no funcionen con normalidad en España. Por el momento se desconocen los motivos del mismo, aunque parece no haber afectado a otros países.Según Downdetector, las tres plataformas comenzaron a sufrir problemas a primera hora de la tarde. Varios usuarios acudieron a Twitter, donde WhatsApp, de hecho, fue tendencia por las preguntas y quejas que aparecieron e Instagramdown se convirtió en Trending Topic.Durante la caída de WhatsApp, Instagram y Facebook resulta imposible acceder a las aplicaciones y versiones web de los servicios, que o dan un mensaje de error o no terminan de cargar. En WhatsApp el servicio funciona de forma interrumpida.Tras aproximadamente una hora de caída Instagram ha sorteado el problema permitiendo acceder a la versión en inglés del servicio, que sí está disponible.Precisamente en julio del año pasado WhatsApp, Facebook e Instagram sufrieron su última gran caída a nivel global. Las tres redes permanecieron inactivas durante varias horas en todo el mundo. En Acción de Gracias también se registraron problemas, si bien fueron mucho menores.Conforme a los criterios deThe Trust ProjectSaber másWhatsAppFacebookInstagramRedes SocialesTecnologíaEl truco de WhatsApp para saber qué contactos están en línea y cuándo se conectanTecnologíaTwitch banea a Donald Trump por publicar contenido de odioTecnologíaFacebook quiere atraer a los youtubers con suscripciones de pagoVer enlaces de interésUltimas noticiasProgramacion TVTraductor inglesCalendario laboralHoroscopo diarioClasificacion Liga SantanderCalendario de ligaPeliculas TVTemasfunction doSomething(element){if(element.parentNode.classList.contains(""ue-c-popular-links--closed"")){return openFeaturedLinks(element.parentNode,element,element.parentNode.querySelectorAll(""ul""));}return closeFeaturedLinks(element.parentNode,element,element.parentNode.querySelectorAll(""ul""));}function openFeaturedLinks(element,button,uls){element&&element.classList.toggle(""ue-c-popular-links--closed"");button&&button.setAttribute('aria-expanded','true');let span=button&&button.querySelector(""span"");span.innerHTML=""Cerrar enlaces de inter&eacute;s"";if(uls){uls.forEach((ul)=>{ul&&ul.setAttribute('aria-hidden','false');ul&&ul.classList.remove(""hidden-content"");})}}function closeFeaturedLinks(element,button,uls){element&&element.classList.toggle(""ue-c-popular-links--closed"");button&&button.setAttribute('aria-expanded','false');let span=button&&button.querySelector(""span"");span.innerHTML=""Ver enlaces de inter&eacute;s"";if(uls){uls.forEach((ul)=>{ul&&ul.setAttribute('aria-hidden','true');ul&&ul.classList.add(""hidden-content"");})}}","WhatsApp, Instagram y Facebook sufren una caída en España",https://www.elmundo.es/tecnologia/2020/07/28/5f20194421efa027488b4600.html,web-scraper/elmundo,www.elmundo.es,273,8
